{"artifacts":[{"bytes":1242,"kind":"config","relative_path":"training-config.json","sha256":"b2f38c925f58b2395f6ecb8eea0267ff4769cf4f521813fa99891df7edc3fcf0"},{"bytes":335,"kind":"split_manifest","relative_path":"split-manifest.json","sha256":"01a5b041136ddc14bcf075ea170aee48644f7e58cb1e16728069712c34a0ba11"},{"bytes":2323,"kind":"table_schema","relative_path":"tables/engineering_training_rows/schema.json","sha256":"a743fba778b816139076a63ed2c93c1bae411fbe6c88a4087440e4524f174ff3"},{"bytes":33116,"kind":"table_data","relative_path":"tables/engineering_training_rows/columns.json.gz","sha256":"f54ab82a88e7b60f1af58611c47a55007ebdd933c127f2e40a64dadcd08ef7bb"},{"bytes":769,"kind":"trusted_pickle_model","relative_path":"models/250ms/base_rate/model.pkl","sha256":"39191f7f6b8278abd14e064d525683e6caee85adb78ae499a5f366bbc7bac5b9"},{"bytes":1211,"kind":"model_card","relative_path":"models/250ms/base_rate/model-card.json","sha256":"2cf238980992c392b1ab204881a37b591af2067ec7fffbe1dbf7feb511e1e3c7"},{"bytes":763,"kind":"table_schema","relative_path":"models/250ms/base_rate/tables/engineering_holdout_predictions/schema.json","sha256":"2cee9118fe66deefc506de842fce4490e4d7af4fd4f3c7c776abf7b51f42b85d"},{"bytes":920,"kind":"table_data","relative_path":"models/250ms/base_rate/tables/engineering_holdout_predictions/columns.json.gz","sha256":"68e7979a60d04dc66ec957d63d01d6b939af12b7156e942620bb5810d7991582"},{"bytes":1012,"kind":"reliability","relative_path":"models/250ms/base_rate/reliability.json","sha256":"3822dd339d2c61b8b5c2754985b77ff28b1d4b7562a793b1543d4e6859ffc334"},{"bytes":2196,"kind":"slice_metrics","relative_path":"models/250ms/base_rate/slice-metrics.json","sha256":"4f106bf97da1cc5d6b0f9fb0a5069b8ae9c014b878df747c070aa110dd27a60d"},{"bytes":2483,"kind":"trusted_pickle_model","relative_path":"models/250ms/logistic/model.pkl","sha256":"a0aae85a2a3624e1a62c48e4a915dee441aadfaa535169ba8a8417ca1d8633a1"},{"bytes":1536,"kind":"model_card","relative_path":"models/250ms/logistic/model-card.json","sha256":"24876cdd55ef7871ab6876e74d221466a3315b22f306a29c3f3f72f1daa23dbf"},{"bytes":763,"kind":"table_schema","relative_path":"models/250ms/logistic/tables/engineering_holdout_predictions/schema.json","sha256":"2cee9118fe66deefc506de842fce4490e4d7af4fd4f3c7c776abf7b51f42b85d"},{"bytes":4257,"kind":"table_data","relative_path":"models/250ms/logistic/tables/engineering_holdout_predictions/columns.json.gz","sha256":"ac4666d0f42ed0cd0e0749e36ec5bd4251232cefaa1083a9eeafbb6b7e508a6c"},{"bytes":1081,"kind":"reliability","relative_path":"models/250ms/logistic/reliability.json","sha256":"1c27ba68ab057d7291910f446df4195e418fb74c3082ba1455879903e6ded34b"},{"bytes":2564,"kind":"slice_metrics","relative_path":"models/250ms/logistic/slice-metrics.json","sha256":"49cbe44d2e07eb6bc8849fd225be19687b3434dc4d00aad7ae0a02ce224dfec7"},{"bytes":110492,"kind":"trusted_pickle_model","relative_path":"models/250ms/gradient_boosted_trees/model.pkl","sha256":"d43207aadf3f0152e1bf1e181ba3a08cce79a1ac588f88f0e3e32e07cababef5"},{"bytes":1834,"kind":"model_card","relative_path":"models/250ms/gradient_boosted_trees/model-card.json","sha256":"621b715fb7690bb7f3cb0a754017991ac2e96d374bc822f566ba36ffa701cf35"},{"bytes":763,"kind":"table_schema","relative_path":"models/250ms/gradient_boosted_trees/tables/engineering_holdout_predictions/schema.json","sha256":"2cee9118fe66deefc506de842fce4490e4d7af4fd4f3c7c776abf7b51f42b85d"},{"bytes":4278,"kind":"table_data","relative_path":"models/250ms/gradient_boosted_trees/tables/engineering_holdout_predictions/columns.json.gz","sha256":"be058a9e14d4e98999ae2a40bcffba05796a14df3e32711e8daffc236a2c6fca"},{"bytes":1039,"kind":"reliability","relative_path":"models/250ms/gradient_boosted_trees/reliability.json","sha256":"b8c8c445c70b87a3a34edfc6c85afd2c599e51935ee809285c7c8a36d49299f5"},{"bytes":2551,"kind":"slice_metrics","relative_path":"models/250ms/gradient_boosted_trees/slice-metrics.json","sha256":"0a63bb44ec228affd41d2e4b00a493a3d1563a74a22e8b9fc63dc8f924a6b448"},{"bytes":14045,"kind":"trusted_pickle_model","relative_path":"models/250ms/simple_mlp/model.pkl","sha256":"8249f3e1c1b9fc51c753087a15dcb3bf69e4e999ba9b35b965888c007d477bd4"},{"bytes":1763,"kind":"model_card","relative_path":"models/250ms/simple_mlp/model-card.json","sha256":"a5af06905242348f347d49db8f8194d506492c469d033526d347d97d0bbd88d8"},{"bytes":763,"kind":"table_schema","relative_path":"models/250ms/simple_mlp/tables/engineering_holdout_predictions/schema.json","sha256":"2cee9118fe66deefc506de842fce4490e4d7af4fd4f3c7c776abf7b51f42b85d"},{"bytes":3919,"kind":"table_data","relative_path":"models/250ms/simple_mlp/tables/engineering_holdout_predictions/columns.json.gz","sha256":"4916be1ed3bf70a28ca1c278981736506670e38982b1a40e469e452775a1fc77"},{"bytes":1012,"kind":"reliability","relative_path":"models/250ms/simple_mlp/reliability.json","sha256":"99a67c9e57f932d0c7458fea5be488afd5dfc66bda71ae8a5989f2ebcdcb0a05"},{"bytes":2552,"kind":"slice_metrics","relative_path":"models/250ms/simple_mlp/slice-metrics.json","sha256":"a50e8e1c3846c1d9266ce2ef3bc41dfc4989f7d8376aa013150b1955d817ff81"},{"bytes":766,"kind":"trusted_pickle_model","relative_path":"models/1s/base_rate/model.pkl","sha256":"5331206a275586f1f4437b7b667d6661e8d041f6cfe05f3be947aeb4ab1bd31c"},{"bytes":1204,"kind":"model_card","relative_path":"models/1s/base_rate/model-card.json","sha256":"0283b86914b8225512467016d68d12fe0705742652d7f2dfd45c1f8c427f0242"},{"bytes":763,"kind":"table_schema","relative_path":"models/1s/base_rate/tables/engineering_holdout_predictions/schema.json","sha256":"2cee9118fe66deefc506de842fce4490e4d7af4fd4f3c7c776abf7b51f42b85d"},{"bytes":937,"kind":"table_data","relative_path":"models/1s/base_rate/tables/engineering_holdout_predictions/columns.json.gz","sha256":"93466ec5a491cf7baa403c4a21c8d75345792ead707572c20cbdd2315b025c43"},{"bytes":1013,"kind":"reliability","relative_path":"models/1s/base_rate/reliability.json","sha256":"1ad95d45b7948ba79c8d31ad56adb941a9cf8f9ba28c3b2cad82c011b476e559"},{"bytes":2182,"kind":"slice_metrics","relative_path":"models/1s/base_rate/slice-metrics.json","sha256":"7174fdb2b96e9ee62c0de0b6fb228dbc0faa11927df1690e00365ebb6241127d"},{"bytes":2480,"kind":"trusted_pickle_model","relative_path":"models/1s/logistic/model.pkl","sha256":"32beb233503f12f461a4bfd232637b8fa941dffa99eba43b812d38e91035fe30"},{"bytes":1532,"kind":"model_card","relative_path":"models/1s/logistic/model-card.json","sha256":"97c18b396b802b6b50cc00e9271f249f351b10bddb1e9fd66e1e3a07962a472b"},{"bytes":763,"kind":"table_schema","relative_path":"models/1s/logistic/tables/engineering_holdout_predictions/schema.json","sha256":"2cee9118fe66deefc506de842fce4490e4d7af4fd4f3c7c776abf7b51f42b85d"},{"bytes":4225,"kind":"table_data","relative_path":"models/1s/logistic/tables/engineering_holdout_predictions/columns.json.gz","sha256":"6c35080a7c3f715f76307101aa0491c423f47a0ae4339d905a4b2606c01961a7"},{"bytes":1126,"kind":"reliability","relative_path":"models/1s/logistic/reliability.json","sha256":"86ee24240fcbf45adf01e13a5aa137e1cec2b3affccd37d634e783a2300e3ece"},{"bytes":2674,"kind":"slice_metrics","relative_path":"models/1s/logistic/slice-metrics.json","sha256":"f41623f7cfa288fcfe26827925b855cc10ff6b90ae51b56468bfbd674ac022c6"},{"bytes":110489,"kind":"trusted_pickle_model","relative_path":"models/1s/gradient_boosted_trees/model.pkl","sha256":"06bdb170f5847ac1b4f5c50eb86edcd89c37f983a64602ca0aeb06be996932ab"},{"bytes":1825,"kind":"model_card","relative_path":"models/1s/gradient_boosted_trees/model-card.json","sha256":"c05d986a10f947ad95cc90f0975e1eba6f17c2cd433ab6a5d6478ed32b342e63"},{"bytes":763,"kind":"table_schema","relative_path":"models/1s/gradient_boosted_trees/tables/engineering_holdout_predictions/schema.json","sha256":"2cee9118fe66deefc506de842fce4490e4d7af4fd4f3c7c776abf7b51f42b85d"},{"bytes":4284,"kind":"table_data","relative_path":"models/1s/gradient_boosted_trees/tables/engineering_holdout_predictions/columns.json.gz","sha256":"cb22f3592bd1d4e1bec00af397d1fa5def03dc1584837f9d5d968f7ba197fda5"},{"bytes":1129,"kind":"reliability","relative_path":"models/1s/gradient_boosted_trees/reliability.json","sha256":"799ada47d3b4627468470892194a0dccf2d240657127d33e90cd0b847a5346e3"},{"bytes":2618,"kind":"slice_metrics","relative_path":"models/1s/gradient_boosted_trees/slice-metrics.json","sha256":"29c8f345f666183bc78f9d4d3b65baf700e13bed9ef6dfdbf6dbb89c1b74c270"},{"bytes":14042,"kind":"trusted_pickle_model","relative_path":"models/1s/simple_mlp/model.pkl","sha256":"4bfe26d8e55ba5ca1b7b6f1b62c7ff5936c2c797c782093b66a1a2a3de968c1b"},{"bytes":1756,"kind":"model_card","relative_path":"models/1s/simple_mlp/model-card.json","sha256":"1aec92667bed36b2f225687b81025dffa7c2d8a51a14cf40e3c566758067f3b2"},{"bytes":763,"kind":"table_schema","relative_path":"models/1s/simple_mlp/tables/engineering_holdout_predictions/schema.json","sha256":"2cee9118fe66deefc506de842fce4490e4d7af4fd4f3c7c776abf7b51f42b85d"},{"bytes":3993,"kind":"table_data","relative_path":"models/1s/simple_mlp/tables/engineering_holdout_predictions/columns.json.gz","sha256":"51a27a23c03a2595a2c2d5487108bc3d393213aa52ba236afef71086f27419c4"},{"bytes":1012,"kind":"reliability","relative_path":"models/1s/simple_mlp/reliability.json","sha256":"a96a74a171b0903aa6343ae6f0bae5c59e71a3dc0ba430b7d0d446d2bc7a425a"},{"bytes":2548,"kind":"slice_metrics","relative_path":"models/1s/simple_mlp/slice-metrics.json","sha256":"fba4371ef7eae1aafa40a72574f024524434204cc560ff31a4e79bdb4a652498"},{"bytes":766,"kind":"trusted_pickle_model","relative_path":"models/5s/base_rate/model.pkl","sha256":"243bd53f346e08db54d36f8f431bb48239c7aacd04569a0b4da0e97682e9438b"},{"bytes":1191,"kind":"model_card","relative_path":"models/5s/base_rate/model-card.json","sha256":"b6aaf410ae3c326736be006ef67815d8245ed3a51bd780332dc8447ed5045ed4"},{"bytes":763,"kind":"table_schema","relative_path":"models/5s/base_rate/tables/engineering_holdout_predictions/schema.json","sha256":"2cee9118fe66deefc506